{"case_id":"requests-6963","adjudication_status":"MODEL_ADJUDICATED","pairings":[{"annotator_a_finding_id":null,"annotator_b_finding_id":"requests-6963-b-001","pairing_status":"REQUIRES_ADJUDICATION","agreement":{"technical_existence":false,"logical_issue_identity":false,"taxonomy":false,"location":false,"severity":false,"should_comment":false},"resolved_finding":null,"rationale":"Reject Annotator B's finding as technically nonexistent for the supported runtime range. The repository declares Python >=3.8 support in setup.py:72. In those Python versions, POSIX expanduser handles a missing passwd entry internally and leaves the path unchanged rather than propagating KeyError; the removed guard addressed obsolete Python behavior. Consequently, get_netrc_auth returns normally when neither candidate path exists, and the sessions.py:478-481 call path does not create the alleged request-preparation failure. The diff's removal of the explicitly historical workaround is therefore not an error-handling regression."}],"missing_context_requests":[],"summary":"The sole proposed finding is rejected. Annotator A's clean assessment is supported: removing the KeyError guard does not regress the repository's supported Python versions, so no developer-facing comment is warranted."}